{
  "contextVersion": 1,
  "operation": "normal",
  "expected": {
    "subject": {
      "accountId": "1001",
      "profileRepositoryId": "9001"
    },
    "evidenceVersion": 1,
    "rulesetVersion": "1.0.0",
    "adapter": {
      "id": "github.com",
      "version": "1"
    }
  },
  "evaluation": {
    "startedAt": "2026-10-15T00:50:00Z",
    "inspectedAt": "2026-10-15T02:00:00Z"
  },
  "normalizedSettings": {
    "version": 1,
    "repositories": {
      "additional": [
        "fixture-owner/extra"
      ],
      "exclude": [
        "fixture-owner/extra"
      ]
    }
  },
  "scope": {
    "repositoryIds": [
      "9001"
    ]
  },
  "comparison": {
    "mode": "snapshot_only"
  }
}
